{
  "$schema": "https://json-schema.org/draft/2020-12/schema",
  "$id": "https://github.com/IamAngusU/ContextBridge/blob/main/docs/schemas/job-contract-v1.schema.json",
  "title": "ContextBridge Job Contract v1",
  "type": "object",
  "additionalProperties": false,
  "required": ["requirements"],
  "properties": {
    "contract_version": { "const": "contextbridge.job.v1", "default": "contextbridge.job.v1" },
    "id": {
      "type": "string",
      "pattern": "^[A-Za-z0-9][A-Za-z0-9._-]{0,127}$",
      "not": { "pattern": "\\.\\." },
      "description": "Relay-assigned execution ID returned by a one-time E2EE reservation. Ordinary producer submissions must omit this field and use Idempotency-Key for retry reconciliation."
    },
    "tenant_id": { "type": "string" },
    "source": { "type": "string" },
    "requirements": {
      "type": "object",
      "additionalProperties": false,
      "required": ["task"],
      "properties": {
        "task": { "type": "string", "minLength": 1 },
        "session_id": { "type": "string" },
        "provider": { "type": "string" },
        "adapter_profile": { "type": "string" },
        "model": { "type": "string" },
        "reasoning": { "type": "string" },
        "adapter_fresh_session": { "type": "boolean" },
        "adapter_ephemeral_session": { "type": "boolean" },
        "group": { "type": "string" },
        "required_tags": { "type": "array", "maxItems": 32, "items": { "type": "string" } },
        "preferred_nodes": { "type": "array", "maxItems": 32, "items": { "type": "string" } },
        "min_free_vram_bytes": { "type": "integer", "minimum": 0 },
        "vision": { "type": "boolean" },
        "input_image_count": { "type": "integer", "minimum": 0, "maximum": 12 },
        "input_image_bytes": { "type": "integer", "minimum": 0, "maximum": 8388608 },
        "input_image_max_bytes": { "type": "integer", "minimum": 0, "maximum": 8388608 },
        "input_image_media_types": {
          "type": "array",
          "maxItems": 4,
          "uniqueItems": true,
          "items": { "type": "string", "enum": ["image/png", "image/jpeg", "image/webp", "image/gif"] }
        },
        "embedding": { "type": "boolean" },
        "egress": { "type": "string", "enum": ["local_only", "remote_allowed"] },
        "max_cost_usd": { "type": "number", "minimum": 0, "maximum": 1000000 }
      }
    },
    "payload": {},
    "sealed_payload": {
      "type": "object",
      "additionalProperties": false,
      "required": ["algorithm", "ephemeral_public", "nonce", "ciphertext"],
      "properties": {
        "algorithm": { "type": "string" },
        "ephemeral_public": { "type": "string" },
        "nonce": { "type": "string" },
        "ciphertext": { "type": "string" }
      }
    },
    "assignment_id": { "type": "string" },
    "assignment_secret": { "type": "string" },
    "priority": { "type": "integer", "minimum": -100, "maximum": 100 },
    "max_attempts": {
      "type": "integer",
      "minimum": 0,
      "maximum": 10,
      "description": "Maximum assignment generations. Automatic reuse is limited to a non-adapter worker capacity or shutdown refusal proven before execution starts; ambiguous execution is never retried. Zero selects relay policy."
    }
  },
  "oneOf": [
    { "required": ["payload"], "not": { "required": ["sealed_payload"] } },
    { "required": ["sealed_payload"], "not": { "required": ["payload"] } }
  ],
  "allOf": [
    { "if": { "required": ["id"] }, "then": { "required": ["assignment_id", "assignment_secret", "sealed_payload"] } },
    { "if": { "required": ["sealed_payload"] }, "then": { "required": ["assignment_id", "assignment_secret"] } },
    {
      "if": { "anyOf": [{ "required": ["assignment_id"] }, { "required": ["assignment_secret"] }] },
      "then": { "required": ["assignment_id", "assignment_secret", "sealed_payload"] }
    }
  ]
}
