{
  "source": "creative-terminal",
  "requirements": {
    "task": "generation",
    "provider": "browser",
    "session_id": "campaign-image-1"
  },
  "payload": {
    "source": "creative-terminal",
    "task": "generation",
    "prompt": "Create a coherent series of three polished editorial illustrations showing a bridge connecting local devices to a private AI compute cloud. Keep the visual language consistent across all three images and do not add text.",
    "output": {
      "mode": "text",
      "max_bytes": 1048576,
      "artifacts": true,
      "max_artifact_bytes": 12582912
    }
  },
  "priority": 10,
  "max_attempts": 1
}
