{
  "contract_version": "contextbridge.job.v1",
  "source": "my-web-app",
  "requirements": { "task": "generation", "provider": "ollama" },
  "payload": {
    "provider": "ollama",
    "prompt": "Summarize the supplied text in two sentences.",
    "text": "Delivery moved to Friday. Notify support.",
    "output": { "mode": "text", "max_bytes": 4096 }
  },
  "max_attempts": 1
}
